{
  "schemaVersion": 1,
  "kind": "benchmark-run",
  "benchmarkID": "asr-smoke-v1",
  "runID": "11111111-1111-4111-8111-111111111111",
  "task": "asr",
  "protocolVersion": 1,
  "implementationRevision": "fixture-revision",
  "modelArtifact": {
    "artifactID": "fixture-asr-v1",
    "sha256": "aaaaaaaaaaaaaaaaaaaaaaaaaaaaaaaaaaaaaaaaaaaaaaaaaaaaaaaaaaaaaaaa"
  },
  "configuration": {
    "beam": "5"
  },
  "corpus": {
    "manifestID": "synthetic-smoke",
    "version": "1.0.0",
    "split": "smoke"
  },
  "environmentRef": "fixture://environment/arm64-offline",
  "hardware": {
    "osVersion": "14.2",
    "architecture": "arm64",
    "unifiedMemoryBytes": 17179869184,
    "toolchainVersion": "Swift 6 fixture"
  },
  "samples": [
    {
      "sampleUUID": "22222222-2222-4222-8222-222222222222",
      "identityAssignments": [],
      "audioDurationNanoseconds": 1000000000,
      "inferenceDurationNanoseconds": 250000000,
      "latencyNanoseconds": 100000000,
      "peakResidentBytes": 1024,
      "backlogHighWatermark": 0
    }
  ]
}
